{
  "schemaVersion": 1,
  "id": "solution-architecture.minimum-design",
  "title": "Minimum sufficient solution design",
  "description": "Guidance for documenting only the boundaries and decisions needed to deliver safely.",
  "ownerDomain": "solution-architecture",
  "version": "1.0.0",
  "kind": "guidance",
  "appliesTo": { "stages": ["solution-design", "delivery-planning", "build-readiness"] },
  "contentRef": "minimum-design.md"
}
