{
  "schemaVersion": 1,
  "id": "product-management.story-writing",
  "title": "Writing traceable stories",
  "description": "Recommended practices for creating small, outcome-oriented, testable delivery stories.",
  "ownerDomain": "product-management",
  "version": "1.0.0",
  "kind": "guidance",
  "appliesTo": { "stages": ["work-item-planning"] },
  "contentRef": "story-writing.md"
}
